{
  "schema_version": 2,
  "object_id": "obj-sha256-5d000b44db178b31c4aca20a5ef5741adb7e14b8297a2139e83f4119c783dd5f",
  "sha256": "5d000b44db178b31c4aca20a5ef5741adb7e14b8297a2139e83f4119c783dd5f",
  "sha512": "20c46b2e7a15a386565c2bd6c76c6948f6b4e3afbf3ac7c62a53967335a39d7ff8e229dd1a692b822495cc0f60485cdd2ac5c29ebc7130738967ac13ea68dbec",
  "size_bytes": 16,
  "media_type": "text/plain",
  "sealed_at": "2026-10-09T20:43:00+09:00",
  "vault_relpath": "10_Evidence/Vault/objects/sha256/5d/00/5d000b44db178b31c4aca20a5ef5741adb7e14b8297a2139e83f4119c783dd5f/payload",
  "source_fidelity": "native_obtained"
}
